{
  "$schema": "../../../../schemas/slope-graph.schema.json",
  "place_slug": "niseko-hanazono",
  "version": 2,
  "nodes": [
    {
      "id": "n-242921130",
      "lat": 42.8793267,
      "lng": 140.6770255,
      "alt_m": 703.0,
      "kind": "lift_bottom"
    },
    {
      "id": "n-242921131",
      "lat": 42.8730882,
      "lng": 140.6676716,
      "alt_m": 1031.0,
      "kind": "lift_top"
    },
    {
      "id": "n-242921195",
      "lat": 42.8779065,
      "lng": 140.6771233,
      "alt_m": 720.0,
      "kind": "lift_top"
    },
    {
      "id": "n-242921196",
      "lat": 42.8824528,
      "lng": 140.6835304,
      "alt_m": 651.0,
      "kind": "lift_bottom"
    },
    {
      "id": "n-242921253",
      "lat": 42.8826745,
      "lng": 140.6843581,
      "alt_m": 647.0,
      "kind": "lift_top"
    },
    {
      "id": "n-242921254",
      "lat": 42.8915433,
      "lng": 140.6994017,
      "alt_m": 301.0,
      "kind": "lift_bottom"
    },
    {
      "id": "n-2232306032",
      "lat": 42.8756519,
      "lng": 140.6777342,
      "alt_m": 719.0,
      "kind": "waypoint"
    },
    {
      "id": "n-2232306138",
      "lat": 42.8771029,
      "lng": 140.6776686,
      "alt_m": 726.0,
      "kind": "merge"
    },
    {
      "id": "n-2232306148",
      "lat": 42.8778466,
      "lng": 140.6770125,
      "alt_m": 720.0,
      "kind": "fork"
    },
    {
      "id": "n-2232488609",
      "lat": 42.8806013,
      "lng": 140.6786847,
      "alt_m": 691.0,
      "kind": "fork"
    },
    {
      "id": "n-2232488672",
      "lat": 42.8825529,
      "lng": 140.6824616,
      "alt_m": 661.0,
      "kind": "fork"
    },
    {
      "id": "n-2232488682",
      "lat": 42.882707,
      "lng": 140.6839987,
      "alt_m": 656.0,
      "kind": "merge"
    },
    {
      "id": "n-2232488741",
      "lat": 42.8851968,
      "lng": 140.6850853,
      "alt_m": 595.0,
      "kind": "merge"
    },
    {
      "id": "n-2232488749",
      "lat": 42.8855892,
      "lng": 140.6854359,
      "alt_m": 595.0,
      "kind": "fork"
    },
    {
      "id": "n-2232488757",
      "lat": 42.8867534,
      "lng": 140.685445,
      "alt_m": 575.0,
      "kind": "fork"
    },
    {
      "id": "n-2232488765",
      "lat": 42.886935,
      "lng": 140.688116,
      "alt_m": 534.0,
      "kind": "fork"
    },
    {
      "id": "n-2232488777",
      "lat": 42.8876025,
      "lng": 140.6958883,
      "alt_m": 369.0,
      "kind": "merge"
    },
    {
      "id": "n-2232488782",
      "lat": 42.8879418,
      "lng": 140.6968831,
      "alt_m": 351.0,
      "kind": "merge"
    },
    {
      "id": "n-2232488807",
      "lat": 42.8902853,
      "lng": 140.6873464,
      "alt_m": 440.0,
      "kind": "merge"
    },
    {
      "id": "n-2232488810",
      "lat": 42.8906691,
      "lng": 140.6911588,
      "alt_m": 378.0,
      "kind": "merge"
    },
    {
      "id": "n-2232488811",
      "lat": 42.8906611,
      "lng": 140.6920767,
      "alt_m": 370.0,
      "kind": "merge"
    },
    {
      "id": "n-3382882689",
      "lat": 42.8788632,
      "lng": 140.6771823,
      "alt_m": 711.0,
      "kind": "merge"
    },
    {
      "id": "n-3382882690",
      "lat": 42.8793198,
      "lng": 140.6774725,
      "alt_m": 702.0,
      "kind": "merge"
    },
    {
      "id": "n-7167855815",
      "lat": 42.8825775,
      "lng": 140.6840433,
      "alt_m": 656.0,
      "kind": "fork"
    },
    {
      "id": "n-7167855817",
      "lat": 42.8813831,
      "lng": 140.6850694,
      "alt_m": 633.0,
      "kind": "merge"
    },
    {
      "id": "n-10148686662",
      "lat": 42.8916888,
      "lng": 140.6992231,
      "alt_m": 298.0,
      "kind": "merge"
    },
    {
      "id": "n-10148686674",
      "lat": 42.8906784,
      "lng": 140.6901247,
      "alt_m": 386.0,
      "kind": "merge"
    },
    {
      "id": "n-10148686675",
      "lat": 42.8894231,
      "lng": 140.6835043,
      "alt_m": 507.0,
      "kind": "lift_top"
    },
    {
      "id": "n-10148686683",
      "lat": 42.890386,
      "lng": 140.6896627,
      "alt_m": 393.0,
      "kind": "waypoint"
    },
    {
      "id": "n-10148686684",
      "lat": 42.8918854,
      "lng": 140.6991211,
      "alt_m": 303.0,
      "kind": "lift_bottom"
    },
    {
      "id": "n-12703795998",
      "lat": 42.8773072,
      "lng": 140.6758418,
      "alt_m": 736.0,
      "kind": "fork"
    }
  ],
  "edges": [
    {
      "id": "e-22650107-242921130",
      "lift_id": "hanazono-quad-3-l22650107",
      "kind": "lift",
      "from": "n-242921130",
      "to": "n-242921131",
      "length_m": 1031.9,
      "geometry": [
        {
          "lat": 42.8793267,
          "lng": 140.6770255,
          "alt_m": 703.0
        },
        {
          "lat": 42.8789515,
          "lng": 140.6764809,
          "alt_m": 715.0
        },
        {
          "lat": 42.8785763,
          "lng": 140.6759362,
          "alt_m": 715.0
        },
        {
          "lat": 42.8781109,
          "lng": 140.6752608,
          "alt_m": 726.0
        },
        {
          "lat": 42.8776354,
          "lng": 140.6745706,
          "alt_m": 720.0
        },
        {
          "lat": 42.8773679,
          "lng": 140.6741823,
          "alt_m": 739.0
        },
        {
          "lat": 42.8771618,
          "lng": 140.6738688,
          "alt_m": 738.0
        },
        {
          "lat": 42.8769567,
          "lng": 140.6735566,
          "alt_m": 738.0
        },
        {
          "lat": 42.8764824,
          "lng": 140.6728348,
          "alt_m": 765.0
        },
        {
          "lat": 42.8757619,
          "lng": 140.6717386,
          "alt_m": 823.0
        },
        {
          "lat": 42.8756437,
          "lng": 140.6715588,
          "alt_m": 839.0
        },
        {
          "lat": 42.8747891,
          "lng": 140.6702584,
          "alt_m": 908.0
        },
        {
          "lat": 42.8745855,
          "lng": 140.6699487,
          "alt_m": 919.0
        },
        {
          "lat": 42.8741221,
          "lng": 140.6692435,
          "alt_m": 967.0
        },
        {
          "lat": 42.8736484,
          "lng": 140.6685227,
          "alt_m": 980.0
        },
        {
          "lat": 42.8733871,
          "lng": 140.6681252,
          "alt_m": 985.0
        },
        {
          "lat": 42.8733343,
          "lng": 140.6680449,
          "alt_m": 985.0
        },
        {
          "lat": 42.8730882,
          "lng": 140.6676716,
          "alt_m": 1031.0
        }
      ],
      "provenance": {
        "source": "osm",
        "osm_way_id": 22650107,
        "observed_count": 4
      }
    },
    {
      "id": "e-22650110-242921196",
      "lift_id": "hanazono-quad-2-l22650110",
      "kind": "lift",
      "from": "n-242921196",
      "to": "n-242921195",
      "length_m": 727.6,
      "geometry": [
        {
          "lat": 42.8824528,
          "lng": 140.6835304,
          "alt_m": 651.0
        },
        {
          "lat": 42.8820599,
          "lng": 140.6829767,
          "alt_m": 658.0
        },
        {
          "lat": 42.8817723,
          "lng": 140.6825713,
          "alt_m": 658.0
        },
        {
          "lat": 42.8813382,
          "lng": 140.6819596,
          "alt_m": 674.0
        },
        {
          "lat": 42.8807416,
          "lng": 140.6811188,
          "alt_m": 690.0
        },
        {
          "lat": 42.8802478,
          "lng": 140.6804229,
          "alt_m": 692.0
        },
        {
          "lat": 42.8798701,
          "lng": 140.6798906,
          "alt_m": 702.0
        },
        {
          "lat": 42.8794447,
          "lng": 140.679291,
          "alt_m": 702.0
        },
        {
          "lat": 42.8789929,
          "lng": 140.6786543,
          "alt_m": 708.0
        },
        {
          "lat": 42.8784678,
          "lng": 140.6779144,
          "alt_m": 709.0
        },
        {
          "lat": 42.8781359,
          "lng": 140.6774466,
          "alt_m": 720.0
        },
        {
          "lat": 42.8779065,
          "lng": 140.6771233,
          "alt_m": 720.0
        }
      ],
      "provenance": {
        "source": "osm",
        "osm_way_id": 22650110,
        "observed_count": 2
      }
    },
    {
      "id": "e-22650115-242921254",
      "lift_id": "hanazono-hooded-lift-1-l22650115",
      "kind": "lift",
      "from": "n-242921254",
      "to": "n-242921253",
      "length_m": 1575.2,
      "geometry": [
        {
          "lat": 42.8915433,
          "lng": 140.6994017,
          "alt_m": 301.0
        },
        {
          "lat": 42.8911224,
          "lng": 140.6986876,
          "alt_m": 307.0
        },
        {
          "lat": 42.8910304,
          "lng": 140.6985316,
          "alt_m": 307.0
        },
        {
          "lat": 42.8909822,
          "lng": 140.6984497,
          "alt_m": 307.0
        },
        {
          "lat": 42.8906565,
          "lng": 140.6978973,
          "alt_m": 317.0
        },
        {
          "lat": 42.890398,
          "lng": 140.6974587,
          "alt_m": 327.0
        },
        {
          "lat": 42.8900511,
          "lng": 140.6968703,
          "alt_m": 327.0
        },
        {
          "lat": 42.8896728,
          "lng": 140.6962285,
          "alt_m": 341.0
        },
        {
          "lat": 42.8894424,
          "lng": 140.6958377,
          "alt_m": 341.0
        },
        {
          "lat": 42.8891075,
          "lng": 140.6952695,
          "alt_m": 363.0
        },
        {
          "lat": 42.8878439,
          "lng": 140.693126,
          "alt_m": 388.0
        },
        {
          "lat": 42.8873543,
          "lng": 140.6922954,
          "alt_m": 430.0
        },
        {
          "lat": 42.8869832,
          "lng": 140.6916659,
          "alt_m": 457.0
        },
        {
          "lat": 42.8865854,
          "lng": 140.6909912,
          "alt_m": 460.0
        },
        {
          "lat": 42.8862334,
          "lng": 140.6903942,